{
  "$schema": "http://json-schema.org/draft-07/schema#",
  "title": "StocksWatch site settings",
  "type": "object",
  "required": ["app", "features"],
  "properties": {
    "app": {
      "type": "object",
      "required": ["name", "version"],
      "properties": {
        "name": { "type": "string" },
        "version": { "type": "string" },
        "environment": {
          "type": "string",
          "enum": ["development", "staging", "production"]
        }
      }
    },
    "features": {
      "type": "object",
      "additionalProperties": { "type": "boolean" }
    },
    "seo": { "type": "object" },
    "ops": { "type": "object" }
  }
}
