{
  "$schema": "./site-settings.schema.json",
  "app": {
    "name": "StocksWatch",
    "version": "0.3.0",
    "environment": "production"
  },
  "features": {
    "adsense": true,
    "datacenterBridge": true,
    "otelScripts": false
  },
  "seo": {
    "requireCustomDomainForAds": true
  },
  "ops": {
    "healthPath": "/health.json",
    "settingsPath": "/settings.json",
    "budgetUsd": 3
  }
}
